titel,kategorie,alter_min,alter_max,medium,ort,quelle,warum,tags,bewaehrt_seit,link
"Der achtsame Tiger","Kinderbuch",3,6,"Kinderbuch","","Jana","Ein ruhiges Buch fuer Abende, an denen alle schon etwas drueber sind. Funktioniert ohne moralischen Zeigefinger.","abendroutine|gefuehle|vorlesen","2024",""
"Rico, Oskar und die Tieferschatten","Kinderbuch",7,10,"Kinderbuch","","Mara","Spannend, warm und klug erzaehlt. Eines dieser Buecher, bei denen Erwachsene gerne mitlesen.","vorlesen|erstleser|spannung","2023",""
"Schlaflieder ohne Kitsch","Audio",0,4,"Musik","","Olli","Sanft genug fuer Einschlafsituationen, aber nicht so nervig, dass Eltern innerlich kuendigen.","einschlafen|musik|ruhig","2025",""
"Abenteuer im Stadtwald","Ort",2,9,"Ausflug","Stadtwald","Lea","Kurze Wege, genug Schatten und mehrere Abbruchoptionen. Ideal, wenn der Tag nicht komplett planbar ist.","draussen|kostenlos|bewegung","2024",""
"Snackbox am Vorabend packen","Alltagshack",1,10,"Hack","","Nico","Nimmt morgens erstaunlich viel Druck raus. Besonders gut bei Kita- und Schultagen mit knappem Timing.","morgenroutine|essen|stressarm","2026",""
"Hörspielreihe mit echten Pausen","Audio",4,8,"Hoerspiel","","Samira","Nicht zu laut, nicht zu hektisch und dadurch auch fuer Autofahrten brauchbar.","autofahrt|audio|ruhig","2025",""
